{
  "id": "08-largest-estimate-per-project",
  "title": "CTE 08 — Largest Estimated Task per Project",
  "difficulty": "medium",
  "topics": ["cte", "row-number", "tie-breaker"],
  "statement": "Với mỗi project có ít nhất một task có estimated_hours KHÁC NULL, lấy 1 task có estimated_hours lớn nhất. Nếu hòa, chọn task có id NHỎ NHẤT. Không lấy task estimate NULL. Mỗi dòng = một project đủ điều kiện. Trả về project_id, task_id, estimated_hours. Bắt buộc luyện bằng WITH ... AS (recursive ở bài yêu cầu đệ quy); judge chấm theo output.",
  "dialect": "postgresql",
  "reference": "reference.sql",
  "output": {
    "row_order": "unordered",
    "strict_column_names": true,
    "strict_column_types": true,
    "columns": [
      {
        "name": "project_id",
        "type": "integer"
      },
      {
        "name": "task_id",
        "type": "integer"
      },
      {
        "name": "estimated_hours",
        "type": "numeric"
      }
    ]
  },
  "limits": {
    "statement_timeout_ms": 5000,
    "max_rows": 10000,
    "max_bytes": 16777216
  },
  "tests": [
    {
      "id": "basic",
      "file": "tests/basic.sql",
      "hidden": false
    },
    {
      "id": "edge",
      "file": "tests/edge.sql",
      "hidden": true
    },
    {
      "id": "empty",
      "file": "tests/empty.sql",
      "hidden": true
    }
  ]
}
