{
  "id": "01-eligible-task-filter",
  "title": "CTE 01 — Available Tasks in Active Projects",
  "difficulty": "easy",
  "topics": ["cte", "filter", "join"],
  "statement": "API cần danh sách task có status AVAILABLE, thuộc project ACTIVE, được tạo từ ngày 2026-01-01 (bao gồm ngày đó). Dùng CTE để xác định các project hợp lệ trước khi lấy task. Mỗi dòng = một task. Trả về task_id, project_id, priority. Không được lấy project ARCHIVED hoặc task có status NULL. Bắt buộc luyện bằng WITH ... AS (recursive ở bài yêu cầu đệ quy); judge chấm theo output.",
  "dialect": "postgresql",
  "reference": "reference.sql",
  "output": {
    "row_order": "unordered",
    "strict_column_names": true,
    "strict_column_types": true,
    "columns": [
      {
        "name": "task_id",
        "type": "integer"
      },
      {
        "name": "project_id",
        "type": "integer"
      },
      {
        "name": "priority",
        "type": "integer"
      }
    ]
  },
  "limits": {
    "statement_timeout_ms": 5000,
    "max_rows": 10000,
    "max_bytes": 16777216
  },
  "tests": [
    {
      "id": "basic",
      "file": "tests/basic.sql",
      "hidden": false
    },
    {
      "id": "edge",
      "file": "tests/edge.sql",
      "hidden": true
    },
    {
      "id": "empty",
      "file": "tests/empty.sql",
      "hidden": true
    }
  ]
}
