{
  "id": "monthly-net-cashflow",
  "title": "CTE 12 — Monthly Net Payments",
  "difficulty": "medium",
  "topics": ["cte", "monthly-report", "conditional-aggregation"],
  "statement": "Finance cần NET tiền theo từng project và tháng YYYY-MM, nhưng CHỈ những tháng có ít nhất 1 payment record. PAID cộng amount, REFUNDED trừ amount, PENDING tính 0; amount NULL tính 0. Một tháng chỉ có PENDING vẫn xuất hiện net_amount 0. Mỗi dòng = (project_id, month). Trả về project_id, month dạng text YYYY-MM, net_amount. Bắt buộc luyện bằng WITH ... AS (recursive ở bài yêu cầu đệ quy); judge chấm theo output.",
  "dialect": "postgresql",
  "reference": "reference.sql",
  "output": {
    "row_order": "unordered",
    "strict_column_names": true,
    "strict_column_types": true,
    "columns": [
      {
        "name": "project_id",
        "type": "integer"
      },
      {
        "name": "month",
        "type": "text"
      },
      {
        "name": "net_amount",
        "type": "numeric"
      }
    ]
  },
  "limits": {
    "statement_timeout_ms": 5000,
    "max_rows": 10000,
    "max_bytes": 16777216
  },
  "tests": [
    {
      "id": "basic",
      "file": "tests/basic.sql",
      "hidden": false
    },
    {
      "id": "edge",
      "file": "tests/edge.sql",
      "hidden": true
    },
    {
      "id": "empty",
      "file": "tests/empty.sql",
      "hidden": true
    }
  ]
}
