{
  "id": "task-capacity",
  "title": "CTE 07 — Available Assignment Slots",
  "difficulty": "medium",
  "topics": ["cte", "pre-aggregation", "left-join", "null"],
  "statement": "Scheduler cần các task thuộc project ACTIVE, trạng thái AVAILABLE hoặc IN_PROGRESS, còn slot assignment. Mỗi ACTIVE assignment chiếm 1 slot, DONE/CANCELLED không chiếm. Một task có thể có 0 ACTIVE assignment. Trả về task_id, active_count, remaining_slots = capacity - active_count; chỉ lấy remaining_slots > 0. Mỗi dòng = task. Bắt buộc luyện bằng WITH ... AS (recursive ở bài yêu cầu đệ quy); judge chấm theo output.",
  "dialect": "postgresql",
  "reference": "reference.sql",
  "output": {
    "row_order": "unordered",
    "strict_column_names": true,
    "strict_column_types": true,
    "columns": [
      {
        "name": "task_id",
        "type": "integer"
      },
      {
        "name": "active_count",
        "type": "bigint"
      },
      {
        "name": "remaining_slots",
        "type": "bigint"
      }
    ]
  },
  "limits": {
    "statement_timeout_ms": 5000,
    "max_rows": 10000,
    "max_bytes": 16777216
  },
  "tests": [
    {
      "id": "basic",
      "file": "tests/basic.sql",
      "hidden": false
    },
    {
      "id": "edge",
      "file": "tests/edge.sql",
      "hidden": true
    },
    {
      "id": "empty",
      "file": "tests/empty.sql",
      "hidden": true
    }
  ]
}
