{
  "id": "05-users-multiple-active-tasks",
  "title": "CTE 05 — Multi-Task Assignment Load",
  "difficulty": "easy",
  "topics": ["cte", "distinct", "group-by"],
  "statement": "Tìm user đang có ÍT NHẤT 2 task KHÁC NHAU với assignment status ACTIVE. Nếu cùng user xuất hiện nhiều ACTIVE assignment cho cùng task thì chỉ tính 1 task. User inactive vẫn tính nếu có assignment. Mỗi dòng = một user. Trả về user_id, active_task_count. Bắt buộc luyện bằng WITH ... AS (recursive ở bài yêu cầu đệ quy); judge chấm theo output.",
  "dialect": "postgresql",
  "reference": "reference.sql",
  "output": {
    "row_order": "unordered",
    "strict_column_names": true,
    "strict_column_types": true,
    "columns": [
      {
        "name": "user_id",
        "type": "integer"
      },
      {
        "name": "active_task_count",
        "type": "bigint"
      }
    ]
  },
  "limits": {
    "statement_timeout_ms": 5000,
    "max_rows": 10000,
    "max_bytes": 16777216
  },
  "tests": [
    {
      "id": "basic",
      "file": "tests/basic.sql",
      "hidden": false
    },
    {
      "id": "edge",
      "file": "tests/edge.sql",
      "hidden": true
    },
    {
      "id": "empty",
      "file": "tests/empty.sql",
      "hidden": true
    }
  ]
}
