{
  "id": "projects-above-average-count",
  "title": "CTE 04 — Projects Above Global Task Average",
  "difficulty": "easy",
  "topics": ["cte", "two-stage-aggregation", "left-join"],
  "statement": "Lấy các project có số lượng task LỚN HƠN trung bình số task trên TOÀN BỘ project. Project 0 task vẫn được tính vào mẫu số của trung bình; chỉ trả về project vượt trung bình nghiêm ngặt. Mỗi dòng = project. Trả về project_id, task_count. Bắt buộc luyện bằng WITH ... AS (recursive ở bài yêu cầu đệ quy); judge chấm theo output.",
  "dialect": "postgresql",
  "reference": "reference.sql",
  "output": {
    "row_order": "unordered",
    "strict_column_names": true,
    "strict_column_types": true,
    "columns": [
      {
        "name": "project_id",
        "type": "integer"
      },
      {
        "name": "task_count",
        "type": "bigint"
      }
    ]
  },
  "limits": {
    "statement_timeout_ms": 5000,
    "max_rows": 10000,
    "max_bytes": 16777216
  },
  "tests": [
    {
      "id": "basic",
      "file": "tests/basic.sql",
      "hidden": false
    },
    {
      "id": "edge",
      "file": "tests/edge.sql",
      "hidden": true
    },
    {
      "id": "empty",
      "file": "tests/empty.sql",
      "hidden": true
    }
  ]
}
