{
  "id": "11-daily-running-hours",
  "title": "CTE 11 — Global Running Work Hours",
  "difficulty": "medium",
  "topics": ["cte", "aggregation", "window", "running-total"],
  "statement": "Lập báo cáo tổng giờ log theo từng logged_on trên TOÀN hệ thống, sau đó tính tổng giờ lũy kế theo thứ tự ngày tăng dần. Một ngày nhiều log phải gộp trước rồi mới cộng dồn. hours NULL tính 0, ngày chỉ có NULL vẫn xuất hiện với 0. Mỗi dòng = một ngày có work_logs. Trả về logged_on, daily_hours, cumulative_hours. Bắt buộc luyện bằng WITH ... AS (recursive ở bài yêu cầu đệ quy); judge chấm theo output.",
  "dialect": "postgresql",
  "reference": "reference.sql",
  "output": {
    "row_order": "unordered",
    "strict_column_names": true,
    "strict_column_types": true,
    "columns": [
      {
        "name": "logged_on",
        "type": "date"
      },
      {
        "name": "daily_hours",
        "type": "numeric"
      },
      {
        "name": "cumulative_hours",
        "type": "numeric"
      }
    ]
  },
  "limits": {
    "statement_timeout_ms": 5000,
    "max_rows": 10000,
    "max_bytes": 16777216
  },
  "tests": [
    {
      "id": "basic",
      "file": "tests/basic.sql",
      "hidden": false
    },
    {
      "id": "edge",
      "file": "tests/edge.sql",
      "hidden": true
    },
    {
      "id": "empty",
      "file": "tests/empty.sql",
      "hidden": true
    }
  ]
}
