{
  "id": "task-forest-depths",
  "title": "CTE 18 — Traverse a Task Hierarchy",
  "difficulty": "hard",
  "topics": ["recursive-cte", "hierarchy", "union-all"],
  "statement": "tasks.parent_task_id tạo các cây phân cấp task. Với mỗi root (parent_task_id IS NULL), duyệt mọi descendant, BAO GỒM root ở depth=0. Dữ liệu đảm bảo là forest hợp lệ: không cycle và mọi non-root dẫn về một root, không có orphan. Mỗi dòng = một task. Trả về task_id, root_task_id, depth, depth phải bắt đầu bằng 0. Bắt buộc luyện bằng WITH ... AS (recursive ở bài yêu cầu đệ quy); judge chấm theo output.",
  "dialect": "postgresql",
  "reference": "reference.sql",
  "output": {
    "row_order": "unordered",
    "strict_column_names": true,
    "strict_column_types": true,
    "columns": [
      {
        "name": "task_id",
        "type": "integer"
      },
      {
        "name": "root_task_id",
        "type": "integer"
      },
      {
        "name": "depth",
        "type": "integer"
      }
    ]
  },
  "limits": {
    "statement_timeout_ms": 5000,
    "max_rows": 10000,
    "max_bytes": 16777216
  },
  "tests": [
    {
      "id": "basic",
      "file": "tests/basic.sql",
      "hidden": false
    },
    {
      "id": "edge",
      "file": "tests/edge.sql",
      "hidden": true
    },
    {
      "id": "empty",
      "file": "tests/empty.sql",
      "hidden": true
    }
  ]
}
