{
  "id": "09-latest-assignment-per-user",
  "title": "CTE 09 — Latest Assignment Audit",
  "difficulty": "medium",
  "topics": ["cte", "row-number", "audit"],
  "statement": "Audit cần assignment MỚI NHẤT của từng user, tính cả DONE và CANCELLED. So sánh assigned_at giảm dần; nếu trùng ngày chọn assignment id LỚN NHẤT. User chưa có assignment không xuất hiện. Mỗi dòng = một user. Trả về user_id, task_id, assigned_at. Bắt buộc luyện bằng WITH ... AS (recursive ở bài yêu cầu đệ quy); judge chấm theo output.",
  "dialect": "postgresql",
  "reference": "reference.sql",
  "output": {
    "row_order": "unordered",
    "strict_column_names": true,
    "strict_column_types": true,
    "columns": [
      {
        "name": "user_id",
        "type": "integer"
      },
      {
        "name": "task_id",
        "type": "integer"
      },
      {
        "name": "assigned_at",
        "type": "date"
      }
    ]
  },
  "limits": {
    "statement_timeout_ms": 5000,
    "max_rows": 10000,
    "max_bytes": 16777216
  },
  "tests": [
    {
      "id": "basic",
      "file": "tests/basic.sql",
      "hidden": false
    },
    {
      "id": "edge",
      "file": "tests/edge.sql",
      "hidden": true
    },
    {
      "id": "empty",
      "file": "tests/empty.sql",
      "hidden": true
    }
  ]
}
