{
  "id": "above-project-average",
  "title": "CTE 02 — Estimates Above Project Average",
  "difficulty": "easy",
  "topics": ["cte", "aggregation", "null"],
  "statement": "Tìm các task có estimated_hours lớn hơn NGHIÊM NGẶT average estimated_hours của các task thuộc cùng project. AVG bỏ qua NULL, task có estimated_hours NULL không được xuất hiện; project có toàn NULL không có kết quả. Mỗi dòng = một task. Trả về task_id, project_id, estimated_hours. Bắt buộc luyện bằng WITH ... AS (recursive ở bài yêu cầu đệ quy); judge chấm theo output.",
  "dialect": "postgresql",
  "reference": "reference.sql",
  "output": {
    "row_order": "unordered",
    "strict_column_names": true,
    "strict_column_types": true,
    "columns": [
      {
        "name": "task_id",
        "type": "integer"
      },
      {
        "name": "project_id",
        "type": "integer"
      },
      {
        "name": "estimated_hours",
        "type": "numeric"
      }
    ]
  },
  "limits": {
    "statement_timeout_ms": 5000,
    "max_rows": 10000,
    "max_bytes": 16777216
  },
  "tests": [
    {
      "id": "basic",
      "file": "tests/basic.sql",
      "hidden": false
    },
    {
      "id": "edge",
      "file": "tests/edge.sql",
      "hidden": true
    },
    {
      "id": "empty",
      "file": "tests/empty.sql",
      "hidden": true
    }
  ]
}
